{
  "$schema": "../../../schemas/update-manifest-v1.schema.json",
  "schemaVersion": 1,
  "productId": "akc-sms",
  "channel": "stable",
  "enabled": true,
  "version": "1.0.1.11",
  "mandatory": true,
  "releaseNotes": "Task Board 카드 압축, 정보 재배치 및 제목 영역 여백 조정",
  "publishedAtUtc": "2026-10-20T00:47:29Z",
  "installer": {
    "fileName": "AKC-SMS-Setup-1.0.1.11.exe",
    "url": "https://github.com/AKC-SW-Team/AKC-Update/releases/download/akc-sms-v1.0.1.11/AKC-SMS-Setup-1.0.1.11.exe",
    "size": 156593550,
    "sha256": "1bad03e9cb43a91b2a7828cad72d6576c2f881371d4f9aed16d62d716fa57408"
  }
}
