{
  "$schema": "../../../schemas/update-manifest-v1.schema.json",
  "schemaVersion": 1,
  "productId": "akc-sms",
  "channel": "staging",
  "enabled": true,
  "version": "1.0.1.7",
  "mandatory": true,
  "releaseNotes": "캘린더 제목 표시 수정 및 사용자별 마지막 Task 등록 제목 자동 입력",
  "publishedAtUtc": "2026-10-13T00:20:54Z",
  "installer": {
    "fileName": "AKC-SMS-Setup-1.0.1.7.exe",
    "url": "https://github.com/AKC-SW-Team/AKC-Update/releases/download/akc-sms-v1.0.1.7/AKC-SMS-Setup-1.0.1.7.exe",
    "size": 156590599,
    "sha256": "ac10ac6d7cf8c1eb847099c59684e7543a12c97e76bd352b1b74f5d4ce590edb"
  }
}
